"Choose Alternatives","Kies alternatieven"
"Unfortunately the product %1 is not available anymore.","Helaas is het product %1 niet meer beschikbaar."
"Please select an alternative for %1 (SKU %2).","Selecteer een alternatief voor %1 (SKU %2)."
"Please select an alternative for this product.","Selecteer een alternatief voor dit product."
"No alternative products available for this product.","Er zijn geen alternatieve producten beschikbaar voor dit product."
"Reorder now","Herbestellen"
"No alternative products available, reordering is not possible.","Er zijn geen alternatieve producten beschikbaar, nabestellen is niet mogelijk."
